{
  "version": "1.0.0",
  "generated_at": "2025-01-01T00:00:00+00:00",
  "repo": {
    "sha": "deadbeef",
    "root": "."
  },
  "link_policy": {
    "mode": "editor",
    "editor_template": "vscode://file/{path}:{line}",
    "github_template": "https://github.com/org/repo/blob/{sha}/{path}#L{line}"
  },
  "artifacts": {
    "docfacts": "docs/_build/docfacts.json",
    "navmap": "site/_build/navmap/navmap.json",
    "by_module": "site/_build/by_module.json",
    "by_file": "site/_build/by_file.json",
    "symbols": "site/_build/symbols.json",
    "test_map": "site/_build/test_map.json",
    "test_map_coverage": "site/_build/test_map_coverage.json",
    "test_map_summary": "site/_build/test_map_summary.json"
  },
  "packages": [
    {
      "name": "demo",
      "modules": [
        {
          "name": "module",
          "qualified": "demo.module",
          "source": {
            "path": "demo/module.py"
          },
          "pages": {
            "html": "site/_build/html/autoapi/src/demo/module/index.html",
            "fjson": "site/_build/json/autoapi/src/demo/module/index.fjson"
          },
          "imports": [
            "demo.utils"
          ],
          "symbols": [
            {
              "qname": "demo.module.fn",
              "kind": "function",
              "symbol_id": "4b227777d4dd1fc61c6f884f48641d02",
              "docfacts": null,
              "anchors": {
                "start_line": 10,
                "end_line": 20,
                "cst_fingerprint": "abc|bcd|cde",
                "remap_order": [
                  {
                    "symbol_id": "4b227777d4dd1fc61c6f884f48641d02",
                    "cst_fingerprint": "abc|bcd|cde",
                    "name_arity": 2,
                    "nearest_text": "def fn(arg1, arg2)"
                  }
                ]
              },
              "quality": {
                "mypy_status": "unknown",
                "ruff_rules": [],
                "pydoclint_parity": null,
                "docstring_coverage": null,
                "doctest_status": "unknown"
              },
              "metrics": {
                "complexity": 1.0,
                "loc": 11,
                "last_modified": "2024-12-31T00:00:00+00:00",
                "codeowners": [],
                "stability": null,
                "deprecated": false
              },
              "agent_hints": {
                "intent_tags": [],
                "safe_ops": [],
                "tests_to_run": [],
                "perf_budgets": [],
                "breaking_change_notes": []
              },
              "change_impact": {
                "callers": [],
                "callees": [
                  "demo.utils.helper"
                ],
                "tests": [
                  {
                    "file": "tests/test_demo.py",
                    "lines": [
                      5
                    ],
                    "reason": "unit",
                    "windows": [
                      {
                        "start": 1,
                        "end": 10
                      }
                    ]
                  }
                ],
                "codeowners": [],
                "churn_last_n": 0
              },
              "exemplars": []
            }
          ],
          "graph": {
            "imports": [
              "demo.utils"
            ],
            "calls": [
              {
                "caller": "demo.module.fn",
                "callee": "demo.utils.helper",
                "confidence": "static"
              }
            ]
          }
        }
      ]
    }
  ],
  "shards": null
}